{"blockers":[],"eligible":true,"generated_at":"2026-07-11T00:00:00.000000Z","modules":{"architecture-patrol":{"blockers":[],"configuration_digest":"bbbbbbbbbbbbbbbbbbbbbbbbbbbbbbbbbbbbbbbbbbbbbbbbbbbbbbbbbbbbbbbb","decision_count":10,"duplicate_effect_count":0,"elapsed_seconds":777600,"ended_at":"2026-07-10T00:00:00.000000Z","started_at":"2026-07-01T00:00:00.000000Z","unexplained_difference_count":0},"patrol":{"blockers":[],"configuration_digest":"aaaaaaaaaaaaaaaaaaaaaaaaaaaaaaaaaaaaaaaaaaaaaaaaaaaaaaaaaaaaaaaa","decision_count":10,"duplicate_effect_count":0,"elapsed_seconds":777600,"ended_at":"2026-07-10T00:00:00.000000Z","started_at":"2026-07-01T00:00:00.000000Z","unexplained_difference_count":0}},"reviewed_at":"2026-07-11T00:00:00.000000Z","reviewer":"operator@example.com","schema":"hive-module-migration-report","schema_version":1,"window":{"ended_at":"2026-07-10T00:00:00.000000Z","started_at":"2026-07-01T00:00:00.000000Z"}}
